<?xml version="1.0" encoding="UTF-8"?>
<!-- version 2 : chaque lieu et chaque espece une seule fois -->
<suivi xmlns:xsi="http://www.w3.org/2001/XMLSchema-instance" xsi:noNamespaceSchemaLocation="observations2.xsd">

  <lieux>
    <lieu id="l1">
      <nom>tours</nom>
      <latitude>47.39</latitude>
      <longitude>0.69</longitude>
    </lieu>
    <lieu id="l2">
      <nom>amboise</nom>
      <latitude>47.41</latitude>
      <longitude>0.98</longitude>
    </lieu>
    <lieu id="l3">
      <nom>chinon</nom>
      <latitude>47.17</latitude>
      <longitude>0.24</longitude>
    </lieu>
  </lieux>

  <especes>
    <espece id="e1">
      <nom>chat</nom>
      <description>petit animal de maison, il dort beaucoup et chasse les souris.</description>
    </espece>
    <espece id="e2">
      <nom>chien</nom>
      <description>animal fidele qui garde la maison et aime jouer dehors.</description>
    </espece>
    <espece id="e3">
      <nom>vache</nom>
      <description>gros animal de la ferme qui mange de l herbe et donne du lait.</description>
    </espece>
    <espece id="e4">
      <nom>mouton</nom>
      <description>animal de la ferme avec de la laine, il vit en troupeau.</description>
    </espece>
  </especes>

  <observations>
    <observation id="o1">
      <espece ref="e1"/>
      <lieu ref="l1"/>
      <annee>2022</annee>
      <nombre>35</nombre>
    </observation>
    <observation id="o2">
      <espece ref="e1"/>
      <lieu ref="l1"/>
      <annee>2023</annee>
      <nombre>40</nombre>
    </observation>
    <observation id="o3">
      <espece ref="e1"/>
      <lieu ref="l1"/>
      <annee>2024</annee>
      <nombre>42</nombre>
    </observation>
    <observation id="o4">
      <espece ref="e2"/>
      <lieu ref="l2"/>
      <annee>2022</annee>
      <nombre>20</nombre>
    </observation>
    <observation id="o5">
      <espece ref="e2"/>
      <lieu ref="l2"/>
      <annee>2023</annee>
      <nombre>18</nombre>
    </observation>
    <observation id="o6">
      <espece ref="e2"/>
      <lieu ref="l2"/>
      <annee>2024</annee>
      <nombre>22</nombre>
    </observation>
    <observation id="o7">
      <espece ref="e3"/>
      <lieu ref="l3"/>
      <annee>2022</annee>
      <nombre>60</nombre>
    </observation>
    <observation id="o8">
      <espece ref="e3"/>
      <lieu ref="l3"/>
      <annee>2023</annee>
      <nombre>55</nombre>
    </observation>
    <observation id="o9">
      <espece ref="e3"/>
      <lieu ref="l3"/>
      <annee>2024</annee>
      <nombre>50</nombre>
    </observation>
    <observation id="o10">
      <espece ref="e4"/>
      <lieu ref="l3"/>
      <annee>2022</annee>
      <nombre>30</nombre>
    </observation>
    <observation id="o11">
      <espece ref="e4"/>
      <lieu ref="l3"/>
      <annee>2023</annee>
      <nombre>12</nombre>
    </observation>
    <observation id="o12">
      <espece ref="e4"/>
      <lieu ref="l3"/>
      <annee>2024</annee>
      <nombre>0</nombre>
    </observation>
  </observations>

</suivi>
